{"schemaVersion":"1.1.0","id":"apoa1","label":"APOA1","interval":{"chromosome":"chr11","start":116313361,"end":117361937},"provenance":{"source":"atlas-api","clientVersion":"0.9.0","pipelineVersion":"0.1.0","queriedAt":"2026-09-12T20:39:11Z","configHash":"63b7cc8d64f3302f","calibrationEpoch":"quantiles>=2026-06-18,indels>=2026-07-14","scorers":["AVI_SCORE","AVI_SCORE_FEATURE_IMPORTANCE","AVI_SCORE_MODEL_FEATURES","RNA_SEQ","ATAC","DNASE","CAGE","PROCAP","CHIP_TF","CHIP_HISTONE","SPLICE_SITE_USAGE","SPLICE_JUNCTIONS","POLYADENYLATION","CONTACT_MAPS"],"hasQuantiles":true},"genes":["APOA1"],"annotations":"annotations.json","variants":[{"variant":{"id":"chr11-116837649-T-G","chromosome":"chr11","position":116837649,"ref":"T","alt":"G","rsid":null,"gene":"APOA1"},"aviPhred":25.9606,"artifacts":{"card":"variants/chr11-116837649-T-G/card.json","tracks":"variants/chr11-116837649-T-G/tracks.json","splice":null,"contact":null,"saturation":"variants/chr11-116837649-T-G/saturation.json"},"note":"Rompe motivo tipo TATA, corazon (anotacion de la captura).","signals":{"overview":{"binSize":128,"length":8192,"interval":{"chromosome":"chr11","start":116313361,"end":117361937},"modalities":{"RNA_SEQ":{"path":"variants/chr11-116837649-T-G/signals/overview/RNA_SEQ.bin","bytes":132632,"tracks":4},"DNASE":{"path":"variants/chr11-116837649-T-G/signals/overview/DNASE.bin","bytes":66480,"tracks":2},"ATAC":{"path":"variants/chr11-116837649-T-G/signals/overview/ATAC.bin","bytes":66472,"tracks":2},"CAGE":{"path":"variants/chr11-116837649-T-G/signals/overview/CAGE.bin","bytes":132552,"tracks":4}}},"detail":{"binSize":1,"length":8192,"interval":{"chromosome":"chr11","start":116833553,"end":116841745},"modalities":{"RNA_SEQ":{"path":"variants/chr11-116837649-T-G/signals/detail/RNA_SEQ.bin","bytes":132624,"tracks":4},"DNASE":{"path":"variants/chr11-116837649-T-G/signals/detail/DNASE.bin","bytes":66472,"tracks":2},"ATAC":{"path":"variants/chr11-116837649-T-G/signals/detail/ATAC.bin","bytes":66472,"tracks":2},"CAGE":{"path":"variants/chr11-116837649-T-G/signals/detail/CAGE.bin","bytes":132544,"tracks":4}}}}}]}