{"schemaVersion":"1.1.0","id":"rpl13a","label":"RPL13A","interval":{"chromosome":"chr19","start":48963320,"end":50011896},"provenance":{"source":"atlas-api","clientVersion":"0.9.0","pipelineVersion":"0.1.0","queriedAt":"2026-09-11T12:36:10Z","configHash":"4cd6fb06e8bb2bed","calibrationEpoch":"quantiles>=2026-06-18,indels>=2026-07-14","scorers":["AVI_SCORE","AVI_SCORE_FEATURE_IMPORTANCE","AVI_SCORE_MODEL_FEATURES","RNA_SEQ","ATAC","DNASE","CAGE","PROCAP","CHIP_TF","CHIP_HISTONE","SPLICE_SITE_USAGE","SPLICE_JUNCTIONS","POLYADENYLATION","CONTACT_MAPS"],"hasQuantiles":true},"genes":["RPL13A"],"annotations":"annotations.json","variants":[{"variant":{"id":"chr19-49487608-C-A","chromosome":"chr19","position":49487608,"ref":"C","alt":"A","rsid":null,"gene":"RPL13A"},"aviPhred":20.0183,"artifacts":{"card":"variants/chr19-49487608-C-A/card.json","tracks":"variants/chr19-49487608-C-A/tracks.json","splice":null,"contact":null,"saturation":"variants/chr19-49487608-C-A/saturation.json"},"signals":{"overview":{"binSize":128,"length":8192,"interval":{"chromosome":"chr19","start":48963320,"end":50011896},"modalities":{"RNA_SEQ":{"path":"signals/overview/RNA_SEQ.bin","bytes":132624,"tracks":4},"DNASE":{"path":"signals/overview/DNASE.bin","bytes":66472,"tracks":2},"ATAC":{"path":"signals/overview/ATAC.bin","bytes":66472,"tracks":2},"CAGE":{"path":"signals/overview/CAGE.bin","bytes":132544,"tracks":4}}},"detail":{"binSize":1,"length":8192,"interval":{"chromosome":"chr19","start":49483512,"end":49491704},"modalities":{"RNA_SEQ":{"path":"signals/detail/RNA_SEQ.bin","bytes":132616,"tracks":4},"DNASE":{"path":"signals/detail/DNASE.bin","bytes":66472,"tracks":2},"ATAC":{"path":"signals/detail/ATAC.bin","bytes":66464,"tracks":2},"CAGE":{"path":"signals/detail/CAGE.bin","bytes":132536,"tracks":4}}}}}]}