{"schemaVersion":"1.1.0","id":"nags","label":"NAGS","interval":{"chromosome":"chr17","start":43477312,"end":44525888},"provenance":{"source":"atlas-api","clientVersion":"0.9.0","pipelineVersion":"0.1.0","queriedAt":"2026-09-12T19:29:57Z","configHash":"9826f0d58a56e355","calibrationEpoch":"quantiles>=2026-06-18,indels>=2026-07-14","scorers":["AVI_SCORE","AVI_SCORE_FEATURE_IMPORTANCE","AVI_SCORE_MODEL_FEATURES","RNA_SEQ","ATAC","DNASE","CAGE","PROCAP","CHIP_TF","CHIP_HISTONE","SPLICE_SITE_USAGE","SPLICE_JUNCTIONS","POLYADENYLATION","CONTACT_MAPS"],"hasQuantiles":true},"genes":["NAGS"],"annotations":"annotations.json","variants":[{"variant":{"id":"chr17-44001600-C-A","chromosome":"chr17","position":44001600,"ref":"C","alt":"A","rsid":null,"gene":"NAGS"},"aviPhred":35.2402,"artifacts":{"card":"variants/chr17-44001600-C-A/card.json","tracks":"variants/chr17-44001600-C-A/tracks.json","splice":null,"contact":null,"saturation":null},"note":"Rompe motivo HNF1 (anotacion de la captura).","signals":{"overview":{"binSize":128,"length":8192,"interval":{"chromosome":"chr17","start":43477312,"end":44525888},"modalities":{"RNA_SEQ":{"path":"variants/chr17-44001600-C-A/signals/overview/RNA_SEQ.bin","bytes":132632,"tracks":4},"DNASE":{"path":"variants/chr17-44001600-C-A/signals/overview/DNASE.bin","bytes":66472,"tracks":2},"ATAC":{"path":"variants/chr17-44001600-C-A/signals/overview/ATAC.bin","bytes":66464,"tracks":2},"CAGE":{"path":"variants/chr17-44001600-C-A/signals/overview/CAGE.bin","bytes":132568,"tracks":4}}},"detail":{"binSize":1,"length":8192,"interval":{"chromosome":"chr17","start":43997504,"end":44005696},"modalities":{"RNA_SEQ":{"path":"variants/chr17-44001600-C-A/signals/detail/RNA_SEQ.bin","bytes":132632,"tracks":4},"DNASE":{"path":"variants/chr17-44001600-C-A/signals/detail/DNASE.bin","bytes":66464,"tracks":2},"ATAC":{"path":"variants/chr17-44001600-C-A/signals/detail/ATAC.bin","bytes":66464,"tracks":2},"CAGE":{"path":"variants/chr17-44001600-C-A/signals/detail/CAGE.bin","bytes":132568,"tracks":4}}}}}]}