{"schemaVersion":"1.0.0","id":"epas1","label":"EPAS1","interval":{"chromosome":"chr2","start":45815896,"end":46864472},"provenance":{"source":"synthetic","clientVersion":"0.9.0","pipelineVersion":"0.1.0","queriedAt":"2026-09-11T10:46:27Z","configHash":"bd0488843468e63c","calibrationEpoch":"quantiles>=2026-06-18,indels>=2026-07-14","notes":"Fixture sintetica, semilla 0. NO son predicciones."},"genes":["EPAS1"],"annotations":"annotations.json","variants":[{"variant":{"id":"chr2-46337512-G-A","chromosome":"chr2","position":46337512,"ref":"G","alt":"A","rsid":"rs570553380","gene":"EPAS1"},"aviPhred":8.372,"artifacts":{"card":"variants/chr2-46337512-G-A/card.json","tracks":"variants/chr2-46337512-G-A/tracks.json","splice":null,"contact":null}}],"signals":{"overview":{"binSize":128,"length":8192,"interval":{"chromosome":"chr2","start":45815896,"end":46864472},"modalities":{"RNA_SEQ":{"path":"signals/overview/RNA_SEQ.bin","bytes":132512,"tracks":4},"ATAC":{"path":"signals/overview/ATAC.bin","bytes":132528,"tracks":4},"DNASE":{"path":"signals/overview/DNASE.bin","bytes":132552,"tracks":4},"CAGE":{"path":"signals/overview/CAGE.bin","bytes":132528,"tracks":4},"PROCAP":{"path":"signals/overview/PROCAP.bin","bytes":132552,"tracks":4},"CHIP_TF":{"path":"signals/overview/CHIP_TF.bin","bytes":132512,"tracks":4},"CHIP_HISTONE":{"path":"signals/overview/CHIP_HISTONE.bin","bytes":132576,"tracks":4},"SPLICE_SITES":{"path":"signals/overview/SPLICE_SITES.bin","bytes":66456,"tracks":2},"SPLICE_SITE_USAGE":{"path":"signals/overview/SPLICE_SITE_USAGE.bin","bytes":66432,"tracks":2},"POLYADENYLATION":{"path":"signals/overview/POLYADENYLATION.bin","bytes":132616,"tracks":4},"CONTACT_MAPS":{"path":"signals/overview/CONTACT_MAPS.bin","bytes":33376,"tracks":1}}},"detail":{"binSize":1,"length":8192,"interval":{"chromosome":"chr2","start":46333416,"end":46341608},"modalities":{"RNA_SEQ":{"path":"signals/detail/RNA_SEQ.bin","bytes":132504,"tracks":4},"ATAC":{"path":"signals/detail/ATAC.bin","bytes":132520,"tracks":4},"DNASE":{"path":"signals/detail/DNASE.bin","bytes":132544,"tracks":4},"CAGE":{"path":"signals/detail/CAGE.bin","bytes":132528,"tracks":4},"PROCAP":{"path":"signals/detail/PROCAP.bin","bytes":132552,"tracks":4},"CHIP_TF":{"path":"signals/detail/CHIP_TF.bin","bytes":132504,"tracks":4},"CHIP_HISTONE":{"path":"signals/detail/CHIP_HISTONE.bin","bytes":132584,"tracks":4},"SPLICE_SITES":{"path":"signals/detail/SPLICE_SITES.bin","bytes":66456,"tracks":2},"SPLICE_SITE_USAGE":{"path":"signals/detail/SPLICE_SITE_USAGE.bin","bytes":66432,"tracks":2},"POLYADENYLATION":{"path":"signals/detail/POLYADENYLATION.bin","bytes":132616,"tracks":4},"CONTACT_MAPS":{"path":"signals/detail/CONTACT_MAPS.bin","bytes":33368,"tracks":1}}}}}