{"schemaVersion":"1.1.0","id":"dnm1","label":"DNM1","interval":{"chromosome":"chr9","start":127701739,"end":128750315},"provenance":{"source":"atlas-api","clientVersion":"0.9.0","pipelineVersion":"0.1.0","queriedAt":"2026-09-13T13:01:16Z","configHash":"e12b11888bbcb030","calibrationEpoch":"quantiles>=2026-06-18,indels>=2026-07-14","scorers":["AVI_SCORE","AVI_SCORE_FEATURE_IMPORTANCE","AVI_SCORE_MODEL_FEATURES","RNA_SEQ","ATAC","DNASE","CAGE","PROCAP","CHIP_TF","CHIP_HISTONE","SPLICE_SITE_USAGE","SPLICE_JUNCTIONS","POLYADENYLATION","CONTACT_MAPS"],"hasQuantiles":true},"genes":["DNM1"],"annotations":"annotations.json","variants":[{"variant":{"id":"chr9-128226027-G-A","chromosome":"chr9","position":128226027,"ref":"G","alt":"A","rsid":"rs747079285","gene":"DNM1"},"aviPhred":32.2156,"artifacts":{"card":"variants/chr9-128226027-G-A/card.json","tracks":"variants/chr9-128226027-G-A/tracks.json","splice":"variants/chr9-128226027-G-A/splice.json","contact":null,"saturation":null},"note":"Splicing, neuronas glutamatergicas (anotacion de la captura).","signals":{"overview":{"binSize":128,"length":8192,"interval":{"chromosome":"chr9","start":127701739,"end":128750315},"modalities":{"RNA_SEQ":{"path":"variants/chr9-128226027-G-A/signals/overview/RNA_SEQ.bin","bytes":132632,"tracks":4},"DNASE":{"path":"variants/chr9-128226027-G-A/signals/overview/DNASE.bin","bytes":66480,"tracks":2},"ATAC":{"path":"variants/chr9-128226027-G-A/signals/overview/ATAC.bin","bytes":66472,"tracks":2},"CAGE":{"path":"variants/chr9-128226027-G-A/signals/overview/CAGE.bin","bytes":132568,"tracks":4}}},"detail":{"binSize":1,"length":8192,"interval":{"chromosome":"chr9","start":128221931,"end":128230123},"modalities":{"RNA_SEQ":{"path":"variants/chr9-128226027-G-A/signals/detail/RNA_SEQ.bin","bytes":132624,"tracks":4},"DNASE":{"path":"variants/chr9-128226027-G-A/signals/detail/DNASE.bin","bytes":66472,"tracks":2},"ATAC":{"path":"variants/chr9-128226027-G-A/signals/detail/ATAC.bin","bytes":66472,"tracks":2},"CAGE":{"path":"variants/chr9-128226027-G-A/signals/detail/CAGE.bin","bytes":132576,"tracks":4}}}}}]}