{"schemaVersion":"1.1.0","id":"btk","label":"BTK","interval":{"chromosome":"chrX","start":100861936,"end":101910512},"provenance":{"source":"atlas-api","clientVersion":"0.9.0","pipelineVersion":"0.1.0","queriedAt":"2026-09-12T19:26:11Z","configHash":"1dd338f7a28175b8","calibrationEpoch":"quantiles>=2026-06-18,indels>=2026-07-14","scorers":["AVI_SCORE","AVI_SCORE_FEATURE_IMPORTANCE","AVI_SCORE_MODEL_FEATURES","RNA_SEQ","ATAC","DNASE","CAGE","PROCAP","CHIP_TF","CHIP_HISTONE","SPLICE_SITE_USAGE","SPLICE_JUNCTIONS","POLYADENYLATION","CONTACT_MAPS"],"hasQuantiles":true},"genes":["BTK"],"annotations":"annotations.json","variants":[{"variant":{"id":"chrX-101386224-T-C","chromosome":"chrX","position":101386224,"ref":"T","alt":"C","rsid":null,"gene":"BTK"},"aviPhred":49.025,"artifacts":{"card":"variants/chrX-101386224-T-C/card.json","tracks":"variants/chrX-101386224-T-C/tracks.json","splice":null,"contact":null,"saturation":null},"note":"Reduce union de SPI1 en promotor (anotacion de la captura).","signals":{"overview":{"binSize":128,"length":8192,"interval":{"chromosome":"chrX","start":100861936,"end":101910512},"modalities":{"RNA_SEQ":{"path":"variants/chrX-101386224-T-C/signals/overview/RNA_SEQ.bin","bytes":132624,"tracks":4},"DNASE":{"path":"variants/chrX-101386224-T-C/signals/overview/DNASE.bin","bytes":66472,"tracks":2},"ATAC":{"path":"variants/chrX-101386224-T-C/signals/overview/ATAC.bin","bytes":66472,"tracks":2},"CAGE":{"path":"variants/chrX-101386224-T-C/signals/overview/CAGE.bin","bytes":132560,"tracks":4}}},"detail":{"binSize":1,"length":8192,"interval":{"chromosome":"chrX","start":101382128,"end":101390320},"modalities":{"RNA_SEQ":{"path":"variants/chrX-101386224-T-C/signals/detail/RNA_SEQ.bin","bytes":132624,"tracks":4},"DNASE":{"path":"variants/chrX-101386224-T-C/signals/detail/DNASE.bin","bytes":66464,"tracks":2},"ATAC":{"path":"variants/chrX-101386224-T-C/signals/detail/ATAC.bin","bytes":66464,"tracks":2},"CAGE":{"path":"variants/chrX-101386224-T-C/signals/detail/CAGE.bin","bytes":132568,"tracks":4}}}}}]}