{"schemaVersion":"1.1.0","id":"celsr2-psrc1","label":"CELSR2 / PSRC1","interval":{"chromosome":"chr1","start":108750680,"end":109799256},"provenance":{"source":"atlas-api","clientVersion":"0.9.0","pipelineVersion":"0.1.0","queriedAt":"2026-09-13T14:01:13Z","configHash":"4bd0cff034a78449","calibrationEpoch":"quantiles>=2026-06-18,indels>=2026-07-14","scorers":["AVI_SCORE","AVI_SCORE_FEATURE_IMPORTANCE","AVI_SCORE_MODEL_FEATURES","RNA_SEQ","ATAC","DNASE","CAGE","PROCAP","CHIP_TF","CHIP_HISTONE","SPLICE_SITE_USAGE","SPLICE_JUNCTIONS","POLYADENYLATION","CONTACT_MAPS"],"hasQuantiles":true},"genes":["CELSR2","PSRC1"],"annotations":"annotations.json","variants":[{"variant":{"id":"chr1-109274968-G-T","chromosome":"chr1","position":109274968,"ref":"G","alt":"T","rsid":"rs12740374","gene":"CELSR2"},"aviPhred":21.7612,"artifacts":{"card":"variants/chr1-109274968-G-T/card.json","tracks":"variants/chr1-109274968-G-T/tracks.json","splice":null,"contact":"variants/chr1-109274968-G-T/contacts.json","saturation":"variants/chr1-109274968-G-T/saturation.json"},"note":"Crea motivo CEBP, efecto inverso (anotacion de la captura). Verificado contra UCSC dbSnp155: rs12740374, la variante de Musunuru et al. 2010 que crea el sitio C/EBP en SORT1/CELSR2.","signals":{"overview":{"binSize":128,"length":8192,"interval":{"chromosome":"chr1","start":108750680,"end":109799256},"modalities":{"RNA_SEQ":{"path":"variants/chr1-109274968-G-T/signals/overview/RNA_SEQ.bin","bytes":132632,"tracks":4},"DNASE":{"path":"variants/chr1-109274968-G-T/signals/overview/DNASE.bin","bytes":66480,"tracks":2},"ATAC":{"path":"variants/chr1-109274968-G-T/signals/overview/ATAC.bin","bytes":66480,"tracks":2},"CAGE":{"path":"variants/chr1-109274968-G-T/signals/overview/CAGE.bin","bytes":132568,"tracks":4}}},"detail":{"binSize":1,"length":8192,"interval":{"chromosome":"chr1","start":109270872,"end":109279064},"modalities":{"RNA_SEQ":{"path":"variants/chr1-109274968-G-T/signals/detail/RNA_SEQ.bin","bytes":132648,"tracks":4},"DNASE":{"path":"variants/chr1-109274968-G-T/signals/detail/DNASE.bin","bytes":66480,"tracks":2},"ATAC":{"path":"variants/chr1-109274968-G-T/signals/detail/ATAC.bin","bytes":66480,"tracks":2},"CAGE":{"path":"variants/chr1-109274968-G-T/signals/detail/CAGE.bin","bytes":132584,"tracks":4}}}}}]}