{"schemaVersion":"1.1.0","id":"wnt7b","label":"WNT7B","interval":{"chromosome":"chr22","start":45444969,"end":46493545},"provenance":{"source":"atlas-api","clientVersion":"0.9.0","pipelineVersion":"0.1.0","queriedAt":"2026-09-12T19:25:22Z","configHash":"9f77fb0fb548400f","calibrationEpoch":"quantiles>=2026-06-18,indels>=2026-07-14","scorers":["AVI_SCORE","AVI_SCORE_FEATURE_IMPORTANCE","AVI_SCORE_MODEL_FEATURES","RNA_SEQ","ATAC","DNASE","CAGE","PROCAP","CHIP_TF","CHIP_HISTONE","SPLICE_SITE_USAGE","SPLICE_JUNCTIONS","POLYADENYLATION","CONTACT_MAPS"],"hasQuantiles":true},"genes":["WNT7B"],"annotations":"annotations.json","variants":[{"variant":{"id":"chr22-45969257-G-A","chromosome":"chr22","position":45969257,"ref":"G","alt":"A","rsid":null,"gene":"WNT7B"},"aviPhred":33.98,"artifacts":{"card":"variants/chr22-45969257-G-A/card.json","tracks":"variants/chr22-45969257-G-A/tracks.json","splice":null,"contact":null,"saturation":null},"note":"Rompe motivo JUN/FOS (anotacion de la captura).","signals":{"overview":{"binSize":128,"length":8192,"interval":{"chromosome":"chr22","start":45444969,"end":46493545},"modalities":{"RNA_SEQ":{"path":"variants/chr22-45969257-G-A/signals/overview/RNA_SEQ.bin","bytes":132632,"tracks":4},"DNASE":{"path":"variants/chr22-45969257-G-A/signals/overview/DNASE.bin","bytes":66472,"tracks":2},"ATAC":{"path":"variants/chr22-45969257-G-A/signals/overview/ATAC.bin","bytes":66472,"tracks":2},"CAGE":{"path":"variants/chr22-45969257-G-A/signals/overview/CAGE.bin","bytes":132560,"tracks":4}}},"detail":{"binSize":1,"length":8192,"interval":{"chromosome":"chr22","start":45965161,"end":45973353},"modalities":{"RNA_SEQ":{"path":"variants/chr22-45969257-G-A/signals/detail/RNA_SEQ.bin","bytes":132624,"tracks":4},"DNASE":{"path":"variants/chr22-45969257-G-A/signals/detail/DNASE.bin","bytes":66472,"tracks":2},"ATAC":{"path":"variants/chr22-45969257-G-A/signals/detail/ATAC.bin","bytes":66464,"tracks":2},"CAGE":{"path":"variants/chr22-45969257-G-A/signals/detail/CAGE.bin","bytes":132576,"tracks":4}}}}}]}