{"schemaVersion":"1.0.0","id":"egln1","label":"EGLN1","interval":{"chromosome":"chr1","start":230866866,"end":231915442},"provenance":{"source":"synthetic","clientVersion":"0.9.0","pipelineVersion":"0.1.0","queriedAt":"2026-09-11T10:30:50Z","configHash":"bd0488843468e63c","calibrationEpoch":"quantiles>=2026-06-18,indels>=2026-07-14","notes":"Fixture sintetica, semilla 0. NO son predicciones."},"genes":["EGLN1"],"annotations":"annotations.json","variants":[{"variant":{"id":"chr1-231389514-C-T","chromosome":"chr1","position":231389514,"ref":"C","alt":"T","rsid":"rs479200","gene":"EGLN1"},"aviPhred":6.25,"artifacts":{"card":"variants/chr1-231389514-C-T/card.json","tracks":"variants/chr1-231389514-C-T/tracks.json","splice":null,"contact":null}},{"variant":{"id":"chr1-231395210-A-G","chromosome":"chr1","position":231395210,"ref":"A","alt":"G","rsid":"rs2064766","gene":"EGLN1"},"aviPhred":5.674,"artifacts":{"card":"variants/chr1-231395210-A-G/card.json","tracks":"variants/chr1-231395210-A-G/tracks.json","splice":null,"contact":null}}],"signals":{"overview":{"binSize":128,"length":8192,"interval":{"chromosome":"chr1","start":230866866,"end":231915442},"modalities":{"RNA_SEQ":{"path":"signals/overview/RNA_SEQ.bin","bytes":132504,"tracks":4},"ATAC":{"path":"signals/overview/ATAC.bin","bytes":132528,"tracks":4},"DNASE":{"path":"signals/overview/DNASE.bin","bytes":132552,"tracks":4},"CAGE":{"path":"signals/overview/CAGE.bin","bytes":132528,"tracks":4},"PROCAP":{"path":"signals/overview/PROCAP.bin","bytes":132560,"tracks":4},"CHIP_TF":{"path":"signals/overview/CHIP_TF.bin","bytes":132512,"tracks":4},"CHIP_HISTONE":{"path":"signals/overview/CHIP_HISTONE.bin","bytes":132584,"tracks":4},"SPLICE_SITES":{"path":"signals/overview/SPLICE_SITES.bin","bytes":66464,"tracks":2},"SPLICE_SITE_USAGE":{"path":"signals/overview/SPLICE_SITE_USAGE.bin","bytes":66440,"tracks":2},"POLYADENYLATION":{"path":"signals/overview/POLYADENYLATION.bin","bytes":132624,"tracks":4},"CONTACT_MAPS":{"path":"signals/overview/CONTACT_MAPS.bin","bytes":33368,"tracks":1}}},"detail":{"binSize":1,"length":8192,"interval":{"chromosome":"chr1","start":231385418,"end":231393610},"modalities":{"RNA_SEQ":{"path":"signals/detail/RNA_SEQ.bin","bytes":132512,"tracks":4},"ATAC":{"path":"signals/detail/ATAC.bin","bytes":132528,"tracks":4},"DNASE":{"path":"signals/detail/DNASE.bin","bytes":132544,"tracks":4},"CAGE":{"path":"signals/detail/CAGE.bin","bytes":132528,"tracks":4},"PROCAP":{"path":"signals/detail/PROCAP.bin","bytes":132552,"tracks":4},"CHIP_TF":{"path":"signals/detail/CHIP_TF.bin","bytes":132512,"tracks":4},"CHIP_HISTONE":{"path":"signals/detail/CHIP_HISTONE.bin","bytes":132584,"tracks":4},"SPLICE_SITES":{"path":"signals/detail/SPLICE_SITES.bin","bytes":66456,"tracks":2},"SPLICE_SITE_USAGE":{"path":"signals/detail/SPLICE_SITE_USAGE.bin","bytes":66432,"tracks":2},"POLYADENYLATION":{"path":"signals/detail/POLYADENYLATION.bin","bytes":132616,"tracks":4},"CONTACT_MAPS":{"path":"signals/detail/CONTACT_MAPS.bin","bytes":33368,"tracks":1}}}}}